{
  "format_version": "1.0",
  "instance_id": "distributional-v1-041",
  "units": "arbitrary_unit",
  "container": {
    "length": 17,
    "width": 8,
    "height": 10
  },
  "box_types": [
    {
      "type_id": "dist-type-01",
      "dimensions": {
        "length": 11,
        "width": 1,
        "height": 5
      },
      "quantity": 13,
      "box_ids": [
        "dist-type-01-001",
        "dist-type-01-002",
        "dist-type-01-003",
        "dist-type-01-004",
        "dist-type-01-005",
        "dist-type-01-006",
        "dist-type-01-007",
        "dist-type-01-008",
        "dist-type-01-009",
        "dist-type-01-010",
        "dist-type-01-011",
        "dist-type-01-012",
        "dist-type-01-013"
      ],
      "allowed_orientations": [
        "LWH",
        "WHL",
        "WLH",
        "HLW"
      ]
    },
    {
      "type_id": "dist-type-02",
      "dimensions": {
        "length": 8,
        "width": 4,
        "height": 2
      },
      "quantity": 18,
      "box_ids": [
        "dist-type-02-001",
        "dist-type-02-002",
        "dist-type-02-003",
        "dist-type-02-004",
        "dist-type-02-005",
        "dist-type-02-006",
        "dist-type-02-007",
        "dist-type-02-008",
        "dist-type-02-009",
        "dist-type-02-010",
        "dist-type-02-011",
        "dist-type-02-012",
        "dist-type-02-013",
        "dist-type-02-014",
        "dist-type-02-015",
        "dist-type-02-016",
        "dist-type-02-017",
        "dist-type-02-018"
      ],
      "allowed_orientations": [
        "HWL",
        "WHL"
      ]
    },
    {
      "type_id": "dist-type-03",
      "dimensions": {
        "length": 2,
        "width": 1,
        "height": 1
      },
      "quantity": 16,
      "box_ids": [
        "dist-type-03-001",
        "dist-type-03-002",
        "dist-type-03-003",
        "dist-type-03-004",
        "dist-type-03-005",
        "dist-type-03-006",
        "dist-type-03-007",
        "dist-type-03-008",
        "dist-type-03-009",
        "dist-type-03-010",
        "dist-type-03-011",
        "dist-type-03-012",
        "dist-type-03-013",
        "dist-type-03-014",
        "dist-type-03-015",
        "dist-type-03-016"
      ],
      "allowed_orientations": [
        "HLW",
        "WLH",
        "LHW"
      ]
    }
  ]
}
