{
  "format_version": "1.0",
  "instance_id": "distributional-v1-058",
  "units": "arbitrary_unit",
  "container": {
    "length": 16,
    "width": 10,
    "height": 9
  },
  "box_types": [
    {
      "type_id": "dist-type-01",
      "dimensions": {
        "length": 6,
        "width": 3,
        "height": 5
      },
      "quantity": 14,
      "box_ids": [
        "dist-type-01-001",
        "dist-type-01-002",
        "dist-type-01-003",
        "dist-type-01-004",
        "dist-type-01-005",
        "dist-type-01-006",
        "dist-type-01-007",
        "dist-type-01-008",
        "dist-type-01-009",
        "dist-type-01-010",
        "dist-type-01-011",
        "dist-type-01-012",
        "dist-type-01-013",
        "dist-type-01-014"
      ],
      "allowed_orientations": [
        "WLH",
        "LWH"
      ]
    },
    {
      "type_id": "dist-type-02",
      "dimensions": {
        "length": 10,
        "width": 2,
        "height": 2
      },
      "quantity": 7,
      "box_ids": [
        "dist-type-02-001",
        "dist-type-02-002",
        "dist-type-02-003",
        "dist-type-02-004",
        "dist-type-02-005",
        "dist-type-02-006",
        "dist-type-02-007"
      ],
      "allowed_orientations": [
        "LWH",
        "HLW"
      ]
    },
    {
      "type_id": "dist-type-03",
      "dimensions": {
        "length": 2,
        "width": 4,
        "height": 2
      },
      "quantity": 12,
      "box_ids": [
        "dist-type-03-001",
        "dist-type-03-002",
        "dist-type-03-003",
        "dist-type-03-004",
        "dist-type-03-005",
        "dist-type-03-006",
        "dist-type-03-007",
        "dist-type-03-008",
        "dist-type-03-009",
        "dist-type-03-010",
        "dist-type-03-011",
        "dist-type-03-012"
      ],
      "allowed_orientations": [
        "WLH",
        "HLW",
        "LWH",
        "LHW"
      ]
    }
  ]
}
