{
  "format_version": "1.0",
  "instance_id": "distributional-v1-055",
  "units": "arbitrary_unit",
  "container": {
    "length": 11,
    "width": 7,
    "height": 18
  },
  "box_types": [
    {
      "type_id": "dist-type-01",
      "dimensions": {
        "length": 2,
        "width": 5,
        "height": 8
      },
      "quantity": 10,
      "box_ids": [
        "dist-type-01-001",
        "dist-type-01-002",
        "dist-type-01-003",
        "dist-type-01-004",
        "dist-type-01-005",
        "dist-type-01-006",
        "dist-type-01-007",
        "dist-type-01-008",
        "dist-type-01-009",
        "dist-type-01-010"
      ],
      "allowed_orientations": [
        "HWL",
        "WLH"
      ]
    },
    {
      "type_id": "dist-type-02",
      "dimensions": {
        "length": 4,
        "width": 3,
        "height": 1
      },
      "quantity": 10,
      "box_ids": [
        "dist-type-02-001",
        "dist-type-02-002",
        "dist-type-02-003",
        "dist-type-02-004",
        "dist-type-02-005",
        "dist-type-02-006",
        "dist-type-02-007",
        "dist-type-02-008",
        "dist-type-02-009",
        "dist-type-02-010"
      ],
      "allowed_orientations": [
        "HLW",
        "LWH",
        "HWL"
      ]
    },
    {
      "type_id": "dist-type-03",
      "dimensions": {
        "length": 2,
        "width": 1,
        "height": 2
      },
      "quantity": 1,
      "box_ids": [
        "dist-type-03-001"
      ],
      "allowed_orientations": [
        "HLW",
        "WHL"
      ]
    },
    {
      "type_id": "dist-type-04",
      "dimensions": {
        "length": 2,
        "width": 5,
        "height": 8
      },
      "quantity": 6,
      "box_ids": [
        "dist-type-04-001",
        "dist-type-04-002",
        "dist-type-04-003",
        "dist-type-04-004",
        "dist-type-04-005",
        "dist-type-04-006"
      ],
      "allowed_orientations": [
        "LWH",
        "WLH",
        "HLW"
      ]
    }
  ]
}
