{
  "format_version": "1.0",
  "instance_id": "benchmark-fragmentation-filler-04",
  "units": "arbitrary_unit",
  "container": {
    "length": 10,
    "width": 8,
    "height": 6
  },
  "box_types": [
    {
      "type_id": "frag-large",
      "dimensions": {
        "length": 6,
        "width": 4,
        "height": 3
      },
      "quantity": 4,
      "box_ids": [
        "frag-large-001",
        "frag-large-002",
        "frag-large-003",
        "frag-large-004"
      ],
      "allowed_orientations": [
        "LWH",
        "LHW",
        "WLH",
        "WHL",
        "HLW",
        "HWL"
      ]
    },
    {
      "type_id": "frag-medium",
      "dimensions": {
        "length": 4,
        "width": 3,
        "height": 2
      },
      "quantity": 6,
      "box_ids": [
        "frag-medium-001",
        "frag-medium-002",
        "frag-medium-003",
        "frag-medium-004",
        "frag-medium-005",
        "frag-medium-006"
      ],
      "allowed_orientations": [
        "LWH",
        "LHW",
        "WLH",
        "WHL",
        "HLW",
        "HWL"
      ]
    },
    {
      "type_id": "frag-filler",
      "dimensions": {
        "length": 2,
        "width": 2,
        "height": 1
      },
      "quantity": 12,
      "box_ids": [
        "frag-filler-001",
        "frag-filler-002",
        "frag-filler-003",
        "frag-filler-004",
        "frag-filler-005",
        "frag-filler-006",
        "frag-filler-007",
        "frag-filler-008",
        "frag-filler-009",
        "frag-filler-010",
        "frag-filler-011",
        "frag-filler-012"
      ],
      "allowed_orientations": [
        "LWH",
        "HLW"
      ]
    }
  ]
}
