{
  "format_version": "1.0",
  "instance_id": "distributional-v1-051",
  "units": "arbitrary_unit",
  "container": {
    "length": 10,
    "width": 7,
    "height": 14
  },
  "box_types": [
    {
      "type_id": "dist-type-01",
      "dimensions": {
        "length": 2,
        "width": 5,
        "height": 7
      },
      "quantity": 5,
      "box_ids": [
        "dist-type-01-001",
        "dist-type-01-002",
        "dist-type-01-003",
        "dist-type-01-004",
        "dist-type-01-005"
      ],
      "allowed_orientations": [
        "WHL",
        "LHW",
        "WLH",
        "HWL"
      ]
    },
    {
      "type_id": "dist-type-02",
      "dimensions": {
        "length": 3,
        "width": 4,
        "height": 3
      },
      "quantity": 2,
      "box_ids": [
        "dist-type-02-001",
        "dist-type-02-002"
      ],
      "allowed_orientations": [
        "LHW",
        "HLW",
        "HWL"
      ]
    },
    {
      "type_id": "dist-type-03",
      "dimensions": {
        "length": 1,
        "width": 1,
        "height": 1
      },
      "quantity": 1,
      "box_ids": [
        "dist-type-03-001"
      ],
      "allowed_orientations": [
        "HWL",
        "LHW",
        "WLH"
      ]
    },
    {
      "type_id": "dist-type-04",
      "dimensions": {
        "length": 4,
        "width": 4,
        "height": 6
      },
      "quantity": 4,
      "box_ids": [
        "dist-type-04-001",
        "dist-type-04-002",
        "dist-type-04-003",
        "dist-type-04-004"
      ],
      "allowed_orientations": [
        "HWL",
        "WLH",
        "WHL"
      ]
    }
  ]
}
