{
  "format_version": "1.0",
  "instance_id": "benchmark-long-thin-residual-01",
  "units": "arbitrary_unit",
  "container": {
    "length": 9,
    "width": 5,
    "height": 3
  },
  "box_types": [
    {
      "type_id": "channel-block",
      "dimensions": {
        "length": 4,
        "width": 4,
        "height": 3
      },
      "quantity": 2,
      "box_ids": [
        "channel-block-001",
        "channel-block-002"
      ],
      "allowed_orientations": [
        "LWH"
      ]
    },
    {
      "type_id": "channel-bar",
      "dimensions": {
        "length": 1,
        "width": 5,
        "height": 3
      },
      "quantity": 2,
      "box_ids": [
        "channel-bar-001",
        "channel-bar-002"
      ],
      "allowed_orientations": [
        "LWH"
      ]
    }
  ]
}
