{
  "format_version": "1.0",
  "instance_id": "distributional-v1-011",
  "units": "arbitrary_unit",
  "container": {
    "length": 15,
    "width": 8,
    "height": 7
  },
  "box_types": [
    {
      "type_id": "dist-type-01",
      "dimensions": {
        "length": 5,
        "width": 6,
        "height": 4
      },
      "quantity": 6,
      "box_ids": [
        "dist-type-01-001",
        "dist-type-01-002",
        "dist-type-01-003",
        "dist-type-01-004",
        "dist-type-01-005",
        "dist-type-01-006"
      ],
      "allowed_orientations": [
        "LHW",
        "LWH",
        "HWL",
        "WLH"
      ]
    },
    {
      "type_id": "dist-type-02",
      "dimensions": {
        "length": 2,
        "width": 2,
        "height": 2
      },
      "quantity": 7,
      "box_ids": [
        "dist-type-02-001",
        "dist-type-02-002",
        "dist-type-02-003",
        "dist-type-02-004",
        "dist-type-02-005",
        "dist-type-02-006",
        "dist-type-02-007"
      ],
      "allowed_orientations": [
        "LHW",
        "WLH",
        "LWH"
      ]
    },
    {
      "type_id": "dist-type-03",
      "dimensions": {
        "length": 1,
        "width": 2,
        "height": 2
      },
      "quantity": 17,
      "box_ids": [
        "dist-type-03-001",
        "dist-type-03-002",
        "dist-type-03-003",
        "dist-type-03-004",
        "dist-type-03-005",
        "dist-type-03-006",
        "dist-type-03-007",
        "dist-type-03-008",
        "dist-type-03-009",
        "dist-type-03-010",
        "dist-type-03-011",
        "dist-type-03-012",
        "dist-type-03-013",
        "dist-type-03-014",
        "dist-type-03-015",
        "dist-type-03-016",
        "dist-type-03-017"
      ],
      "allowed_orientations": [
        "LHW",
        "HWL"
      ]
    }
  ]
}
