{
  "format_version": "1.0",
  "instance_id": "benchmark-competing-structures-01",
  "units": "arbitrary_unit",
  "container": {
    "length": 6,
    "width": 6,
    "height": 4
  },
  "box_types": [
    {
      "type_id": "compete-large",
      "dimensions": {
        "length": 4,
        "width": 3,
        "height": 4
      },
      "quantity": 2,
      "box_ids": [
        "compete-large-001",
        "compete-large-002"
      ],
      "allowed_orientations": [
        "LWH",
        "WLH"
      ]
    },
    {
      "type_id": "compete-medium",
      "dimensions": {
        "length": 3,
        "width": 2,
        "height": 2
      },
      "quantity": 8,
      "box_ids": [
        "compete-medium-001",
        "compete-medium-002",
        "compete-medium-003",
        "compete-medium-004",
        "compete-medium-005",
        "compete-medium-006",
        "compete-medium-007",
        "compete-medium-008"
      ],
      "allowed_orientations": [
        "LWH",
        "LHW",
        "WLH",
        "WHL",
        "HLW",
        "HWL"
      ]
    }
  ]
}
