{
  "format_version": "1.0",
  "instance_id": "distributional-v1-040",
  "units": "arbitrary_unit",
  "container": {
    "length": 13,
    "width": 13,
    "height": 6
  },
  "box_types": [
    {
      "type_id": "dist-type-01",
      "dimensions": {
        "length": 7,
        "width": 8,
        "height": 2
      },
      "quantity": 8,
      "box_ids": [
        "dist-type-01-001",
        "dist-type-01-002",
        "dist-type-01-003",
        "dist-type-01-004",
        "dist-type-01-005",
        "dist-type-01-006",
        "dist-type-01-007",
        "dist-type-01-008"
      ],
      "allowed_orientations": [
        "WLH",
        "WHL",
        "HLW"
      ]
    },
    {
      "type_id": "dist-type-02",
      "dimensions": {
        "length": 3,
        "width": 2,
        "height": 2
      },
      "quantity": 9,
      "box_ids": [
        "dist-type-02-001",
        "dist-type-02-002",
        "dist-type-02-003",
        "dist-type-02-004",
        "dist-type-02-005",
        "dist-type-02-006",
        "dist-type-02-007",
        "dist-type-02-008",
        "dist-type-02-009"
      ],
      "allowed_orientations": [
        "HWL",
        "WLH"
      ]
    },
    {
      "type_id": "dist-type-03",
      "dimensions": {
        "length": 3,
        "width": 2,
        "height": 1
      },
      "quantity": 9,
      "box_ids": [
        "dist-type-03-001",
        "dist-type-03-002",
        "dist-type-03-003",
        "dist-type-03-004",
        "dist-type-03-005",
        "dist-type-03-006",
        "dist-type-03-007",
        "dist-type-03-008",
        "dist-type-03-009"
      ],
      "allowed_orientations": [
        "LHW",
        "HLW",
        "WHL"
      ]
    }
  ]
}
