{
  "format_version": "1.0",
  "instance_id": "distributional-v1-059",
  "units": "arbitrary_unit",
  "container": {
    "length": 9,
    "width": 10,
    "height": 11
  },
  "box_types": [
    {
      "type_id": "dist-type-01",
      "dimensions": {
        "length": 2,
        "width": 5,
        "height": 7
      },
      "quantity": 14,
      "box_ids": [
        "dist-type-01-001",
        "dist-type-01-002",
        "dist-type-01-003",
        "dist-type-01-004",
        "dist-type-01-005",
        "dist-type-01-006",
        "dist-type-01-007",
        "dist-type-01-008",
        "dist-type-01-009",
        "dist-type-01-010",
        "dist-type-01-011",
        "dist-type-01-012",
        "dist-type-01-013",
        "dist-type-01-014"
      ],
      "allowed_orientations": [
        "HWL",
        "LHW",
        "LWH",
        "WHL"
      ]
    },
    {
      "type_id": "dist-type-02",
      "dimensions": {
        "length": 2,
        "width": 1,
        "height": 1
      },
      "quantity": 13,
      "box_ids": [
        "dist-type-02-001",
        "dist-type-02-002",
        "dist-type-02-003",
        "dist-type-02-004",
        "dist-type-02-005",
        "dist-type-02-006",
        "dist-type-02-007",
        "dist-type-02-008",
        "dist-type-02-009",
        "dist-type-02-010",
        "dist-type-02-011",
        "dist-type-02-012",
        "dist-type-02-013"
      ],
      "allowed_orientations": [
        "LHW",
        "WHL"
      ]
    },
    {
      "type_id": "dist-type-03",
      "dimensions": {
        "length": 1,
        "width": 1,
        "height": 2
      },
      "quantity": 9,
      "box_ids": [
        "dist-type-03-001",
        "dist-type-03-002",
        "dist-type-03-003",
        "dist-type-03-004",
        "dist-type-03-005",
        "dist-type-03-006",
        "dist-type-03-007",
        "dist-type-03-008",
        "dist-type-03-009"
      ],
      "allowed_orientations": [
        "WHL",
        "LWH"
      ]
    }
  ]
}
